[
  {
    "schema_version": "1.0.0",
    "step_index": 1,
    "step_kind": "plan_proposal",
    "o": {
      "anchor": {
        "how_id": "F1",
        "how_zh": "可见光和热成像一开始就拼成一张图",
        "seeds": [
          42
        ],
        "dataset_id": "rgbt_tiny_v1",
        "slice_id": "low_light_subset_v1",
        "budget_class": "formal",
        "stop": false,
        "status": null,
        "missing": false,
        "parent_run_id": "exec_31eff20c4e0c"
      },
      "protocol": {
        "editable_scope": [
          "fusion",
          "neck",
          "loss",
          "optimizer",
          "hyperparameter",
          "augmentation"
        ],
        "frozen_scope": [
          "dataset_split",
          "evaluator",
          "metric_definition",
          "condition_slice",
          "baseline_result",
          "gate_rule",
          "human_permission_policy"
        ],
        "may_change_dataset": false,
        "fingerprint_id": "FP-RGBT-DFINE-V26-LOWLIGHT"
      },
      "literature": null
    },
    "h": {
      "hypothesis": "Gated multiscale fusion (F3) may better align RGB and thermal features under low-light conditions by adaptively weighting complementary scales, potentially improving small object detection where early concatenation (F1) could suffer from modality imbalance or noise dominance.",
      "selected_action": "probe_fusion",
      "problem_observed": "ExperimentEvidence: R0 F1 early_concat APS_lowlight=0.0045926865160844455 on low_light_subset_v1 val (pycocotools, 100 images / 851 anns), parent_run=exec_31eff20c4e0c. G2 comparator; not A4; not full-set APS/mAP. LiteratureEvidence (NOT ExperimentEvidence; no full text; provider=fake because SEMANTIC_SCHOLAR_API_KEY is unset): [] Do not claim paper body details. Keep budget_class=formal, same slice/fingerprint family. Select a registered HOW: F0/F1/F3/N0. Prefer a HOW other than repeating R0 F1 if a mechanism hypothesis exists.",
      "risk": "llm Planner; fail closed; Adapter remains HOW-only",
      "candidate_actions": [
        "continue_module",
        "switch_module",
        "replicate",
        "NEED_HUMAN"
      ],
      "expected_effect": "increase APS_lowlight",
      "decision_basis": [
        "llm_planner_contract",
        "requested_module=fusion",
        "review_decision=None",
        "cited_lessons=['LESSON-V26-R0-001']",
        "cited_strategies=['STRATEGY-V26-R0-001']",
        "prompt_hash=b9d20b831d0fbcb182516a4456e2ed8aa986771570d3bd149829e52e44e4e9a1",
        "Adapter remains HOW-only; Gate is not bypassed"
      ]
    },
    "a": {
      "tool": "propose_plan",
      "how_id": "F3",
      "how_zh": "可见光、热成像各走一路，再用门控融合",
      "seeds": [
        42
      ],
      "stop": false
    },
    "y": {
      "plan_schema_valid": true,
      "plan_schema_error": null,
      "how_in_catalog": true,
      "how_visible_to_planner": true
    },
    "r": null,
    "m": {
      "exporter_version": "atdp6_v1",
      "step_kind": "plan_proposal",
      "project_id": "project_rgbt_cuda_001",
      "round_id": "1",
      "run_id": "run_plan_round1_from_exec_31eff20c4e0c",
      "event_id": "evt_e94fe8c28e22",
      "actor_role": "planner",
      "phase": "planning",
      "plan_id": "plan_round1_from_exec_31eff20c4e0c",
      "fingerprint_id": "FP-RGBT-DFINE-V26-LOWLIGHT",
      "git_sha": null,
      "reconstructed": false,
      "source_event_types": [
        "plan_proposal"
      ]
    }
  },
  {
    "schema_version": "1.0.0",
    "step_index": 2,
    "step_kind": "gate_decision",
    "o": {
      "plan_contract": {
        "how_id": "F3",
        "how_zh": "可见光、热成像各走一路，再用门控融合",
        "seeds": [
          42
        ],
        "dataset_id": "rgbt_tiny_v1",
        "slice_id": "low_light_subset_v1",
        "budget_class": "formal",
        "stop": false
      },
      "allowed_changes": [
        "fusion"
      ],
      "frozen_variables": [
        "dataset_split",
        "evaluator",
        "metric_definition",
        "condition_slice",
        "baseline_result",
        "gate_rule",
        "human_permission_policy"
      ]
    },
    "h": {
      "problem_observed": "计划已写出，等待协议闸门 / 人闸",
      "selected_action": "approve",
      "decision_basis": [
        "formal budget requires Human Gate"
      ],
      "risk": ""
    },
    "a": {
      "action": "approve",
      "gate_status": "HUMAN_REQUIRED",
      "reason_type": null
    },
    "y": {
      "status": "HUMAN_REQUIRED",
      "training_eligible": true,
      "human_gate_confirmed": true,
      "reasons": [
        "formal budget requires Human Gate"
      ]
    },
    "r": null,
    "m": {
      "exporter_version": "atdp6_v1",
      "step_kind": "gate_decision",
      "project_id": "project_rgbt_cuda_001",
      "round_id": "1",
      "run_id": "run_plan_round1_from_exec_31eff20c4e0c",
      "event_id": "evt_b37b9caac2af",
      "actor_role": "gate",
      "phase": "planning",
      "plan_id": "plan_round1_from_exec_31eff20c4e0c",
      "fingerprint_id": "FP-RGBT-DFINE-V26-LOWLIGHT",
      "git_sha": null,
      "reconstructed": false,
      "source_event_types": [
        "gate_decision",
        "human_governance"
      ]
    }
  },
  {
    "schema_version": "1.0.0",
    "step_index": 3,
    "step_kind": "execution",
    "o": {
      "approved_contract": {
        "how_id": "F3",
        "how_zh": "可见光、热成像各走一路，再用门控融合",
        "seeds": [
          42
        ],
        "dataset_id": "rgbt_tiny_v1",
        "slice_id": "low_light_subset_v1",
        "budget_class": "formal",
        "stop": false,
        "source": "contract"
      }
    },
    "h": {
      "problem_observed": "已批准合同，Adapter 翻译 HOW",
      "selected_action": "F3",
      "decision_basis": [
        "fusion_method=gated_multiscale",
        "neck_type=standard"
      ],
      "expected_effect": "按合同执行，不发明算子"
    },
    "a": {
      "tool": "run_experiment",
      "executed_how_id": "F3",
      "executed_how_zh": "可见光、热成像各走一路，再用门控融合",
      "executed_seeds": [
        42
      ]
    },
    "y": {
      "observed": true,
      "run_state": "MEMORY_WRITTEN",
      "execution_status": "completed",
      "primary_metric": "APS_lowlight",
      "primary_value": 0.02135704762627717,
      "metrics_forged": false,
      "APS_lowlight": 0.02135704762627717
    },
    "r": null,
    "m": {
      "exporter_version": "atdp6_v1",
      "step_kind": "execution",
      "project_id": "project_rgbt_cuda_001",
      "round_id": "1",
      "run_id": "run_plan_round1_from_exec_31eff20c4e0c",
      "event_id": "evt_80688071b3dd",
      "actor_role": "executor",
      "phase": "experiment",
      "plan_id": "plan_round1_from_exec_31eff20c4e0c",
      "fingerprint_id": "FP-RGBT-DFINE-V26-LOWLIGHT",
      "git_sha": null,
      "reconstructed": false,
      "source_event_types": [
        "execution",
        "metrics_parsed",
        "materialize"
      ]
    }
  },
  {
    "schema_version": "1.0.0",
    "step_index": 4,
    "step_kind": "review_decision",
    "o": {
      "primary_metric": "APS_lowlight",
      "after": 0.02135704762627717,
      "before": 0.0045926865160844455,
      "delta": 0.016764361110192725,
      "execution_matched_plan": true
    },
    "h": {
      "hypothesis": "Gated multiscale fusion (F3) may better align RGB and thermal features under low-light conditions by adaptively weighting complementary scales, potentially improving small object detection where early concatenation (F1) could suffer from modality imbalance or noise dominance.",
      "selected_action": "KEEP",
      "problem_observed": "ExperimentEvidence: R0 F1 early_concat APS_lowlight=0.0045926865160844455 on low_light_subset_v1 val (pycocotools, 100 images / 851 anns), parent_run=exec_31eff20c4e0c. G2 comparator; not A4; not full-set APS/mAP. LiteratureEvidence (NOT ExperimentEvidence; no full text; provider=fake because SEMANTIC_SCHOLAR_API_KEY is unset): [] Do not claim paper body details. Keep budget_class=formal, same slice/fingerprint family. Select a registered HOW: F0/F1/F3/N0. Prefer a HOW other than repeating R0 F1 if a mechanism hypothesis exists.",
      "risk": "rules-first Reviewer; no free-form CoT",
      "candidate_actions": [
        "KEEP",
        "DISCARD",
        "REPLICATE",
        "VALIDATE",
        "ESCALATE"
      ],
      "expected_effect": "increase",
      "decision_basis": [
        "suggest_discard_threshold=False",
        "suggest_validate=False",
        "keep_threshold_ok=True",
        "constraints_ok=True",
        "primary_delta=0.016764361110192725"
      ]
    },
    "a": {
      "action": "KEEP"
    },
    "y": {
      "review_decision": "KEEP",
      "hypothesis_status": "SUPPORTED",
      "lesson_ids": [
        "LESSON-run_plan_round1_from_exec_31eff20c4e0c-001"
      ],
      "strategy_ids": [
        "STRATEGY-run_plan_round1_from_exec_31eff20c4e0c-001"
      ],
      "claim_gate_status": "BLOCKED",
      "keep_is_not_claim": true,
      "memory_written": true
    },
    "r": null,
    "m": {
      "exporter_version": "atdp6_v1",
      "step_kind": "review_decision",
      "project_id": "project_rgbt_cuda_001",
      "round_id": "1",
      "run_id": "run_plan_round1_from_exec_31eff20c4e0c",
      "event_id": "evt_9dca6fd78ae6",
      "actor_role": "reviewer",
      "phase": "review",
      "plan_id": "plan_round1_from_exec_31eff20c4e0c",
      "fingerprint_id": "FP-RGBT-DFINE-V26-LOWLIGHT",
      "git_sha": null,
      "reconstructed": false,
      "source_event_types": [
        "review_decision",
        "memory_write",
        "claim_gate"
      ]
    }
  }
]
